{
  "$schema": "https://json-schema.org/draft/2020-12/schema",
  "additionalProperties": false,
  "properties": {
    "catalogs": {
      "items": {
        "additionalProperties": false,
        "properties": {
          "bytes": {
            "minimum": 0,
            "type": "integer"
          },
          "path": {
            "minLength": 1,
            "type": "string"
          },
          "sha256": {
            "pattern": "^[0-9a-f]{64}$",
            "type": "string"
          }
        },
        "required": [
          "path",
          "bytes",
          "sha256"
        ],
        "type": "object"
      },
      "minItems": 1,
      "type": "array",
      "uniqueItems": true
    },
    "commit": {
      "pattern": "^[0-9a-f]{40}$",
      "type": "string"
    },
    "data_roots": {
      "items": {
        "additionalProperties": false,
        "properties": {
          "bytes": {
            "minimum": 0,
            "type": "integer"
          },
          "path": {
            "minLength": 1,
            "type": "string"
          },
          "sha256": {
            "pattern": "^[0-9a-f]{64}$",
            "type": "string"
          }
        },
        "required": [
          "path",
          "bytes",
          "sha256"
        ],
        "type": "object"
      },
      "minItems": 1,
      "type": "array",
      "uniqueItems": true
    },
    "mode": {
      "enum": [
        "synthetic",
        "real"
      ]
    },
    "schema": {
      "const": "release-recipe-v1"
    }
  },
  "required": [
    "schema",
    "commit",
    "mode",
    "catalogs"
  ],
  "type": "object"
}
